Command:
tcpdump

Output:
tcpdump: verbose output suppressed, use -v[v]... for full protocol decode
listening on eth0, link-type EN10MB (Ethernet), snapshot length 262144 bytes
18:18:42.568305 IP bras-base-toroon0569w-grc-41-174-94-67-255.dsl.bell.ca.59827 > lamp-ubuntu-s-1vcpu-1gb-tor1-01.ssh: Flags [P.], seq 2876628533:2876628569, ack 2065573695, win 2048, options [nop,nop,TS val 2197170058 ecr 95960129], length 36
18:18:42.569016 IP lamp-ubuntu-s-1vcpu-1gb-tor1-01.ssh > bras-base-toroon0569w-grc-41-174-94-67-255.dsl.bell.ca.59827: Flags [P.], seq 1:37, ack 36, win 5006, options [nop,nop,TS val 95960149 ecr 2197170058], length 36
18:18:42.569420 IP lamp-ubuntu-s-1vcpu-1gb-tor1-01.ssh > bras-base-toroon0569w-grc-41-174-94-67-255.dsl.bell.ca.59827: Flags [P.], seq 37:145, ack 36, win 5006, options [nop,nop,TS val 95960150 ecr 2197170058], length 108
18:18:42.569466 IP lamp-ubuntu-s-1vcpu-1gb-tor1-01.ssh > bras-base-toroon0569w-grc-41-174-94-67-255.dsl.bell.ca.59827: Flags [P.], seq 145:181, ack 36, win 5006, options [nop,nop,TS val 95960150 ecr 2197170058], length 36
18:18:42.569504 IP lamp-ubuntu-s-1vcpu-1gb-tor1-01.ssh > bras-base-toroon0569w-grc-41-174-94-67-255.dsl.bell.ca.59827: Flags [P.], seq 181:233, ack 36, win 5006, options [nop,nop,TS val 95960150 ecr 2197170058], length 52
18:18:42.569542 IP lamp-ubuntu-s-1vcpu-1gb-tor1-01.ssh > bras-base-toroon0569w-grc-41-174-94-67-255.dsl.bell.ca.59827: Flags [P.], seq 233:301, ack 36, win 5006, options [nop,nop,TS val 95960150 ecr 2197170058], length 68
18:18:42.569579 IP lamp-ubuntu-s-1vcpu-1gb-tor1-01.ssh > bras-base-toroon0569w-grc-41-174-94-67-255.dsl.bell.ca.59827: Flags [P.], seq 301:369, ack 36, win 5006, options [nop,nop,TS val 95960150 ecr 2197170058], length 68
18:18:42.569613 IP lamp-ubuntu-s-1vcpu-1gb-tor1-01.ssh > bras-base-toroon0569w-grc-41-174-94-67-255.dsl.bell.ca.59827: Flags [P.], seq 369:405, ack 36, win 5006, options [nop,nop,TS val 95960150 ecr 2197170058], length 36
18:18:42.578389 IP bras-base-toroon0569w-grc-41-174-94-67-255.dsl.bell.ca.59827 > lamp-ubuntu-s-1vcpu-1gb-tor1-01.ssh: Flags [.], ack 405, win 2042, options [nop,nop,TS val 2197170069 ecr 95960150], length 0
18:18:42.590114 IP bras-base-toroon0569w-grc-41-174-94-67-255.dsl.bell.ca.59827 > lamp-ubuntu-s-1vcpu-1gb-tor1-01.ssh: Flags [P.], seq 36:72, ack 405, win 2048, options [nop,nop,TS val 2197170081 ecr 95960150], length 36
18:18:42.590346 IP lamp-ubuntu-s-1vcpu-1gb-tor1-01.ssh > bras-base-toroon0569w-grc-41-174-94-67-255.dsl.bell.ca.59827: Flags [P.], seq 405:441, ack 72, win 5006, options [nop,nop,TS val 95960171 ecr 2197170081], length 36
18:18:42.598224 IP bras-base-toroon0569w-grc-41-174-94-67-255.dsl.bell.ca.59827 > lamp-ubuntu-s-1vcpu-1gb-tor1-01.ssh: Flags [.], ack 441, win 2048, options [nop,nop,TS val 2197170089 ecr 95960171], length 0
18:18:42.611283 IP bras-base-toroon0569w-grc-41-174-94-67-255.dsl.bell.ca.59827 > lamp-ubuntu-s-1vcpu-1gb-tor1-01.ssh: Flags [P.], seq 72:108, ack 441, win 2048, options [nop,nop,TS val 2197170102 ecr 95960171], length 36
18:18:42.611473 IP lamp-ubuntu-s-1vcpu-1gb-tor1-01.ssh > bras-base-toroon0569w-grc-41-174-94-67-255.dsl.bell.ca.59827: Flags [P.], seq 441:477, ack 108, win 5006, options [nop,nop,TS val 95960192 ecr 2197170102], length 36
18:18:42.619055 IP bras-base-toroon0569w-grc-41-174-94-67-255.dsl.bell.ca.59827 > lamp-ubuntu-s-1vcpu-1gb-tor1-01.ssh: Flags [.], ack 477, win 2048, options [nop,nop,TS val 2197170109 ecr 95960192], length 0
18:18:42.634823 IP bras-base-toroon0569w-grc-41-174-94-67-255.dsl.bell.ca.59827 > lamp-ubuntu-s-1vcpu-1gb-tor1-01.ssh: Flags [P.], seq 108:144, ack 477, win 2048, options [nop,nop,TS val 2197170125 ecr 95960192], length 36
18:18:42.635041 IP lamp-ubuntu-s-1vcpu-1gb-tor1-01.ssh > bras-base-toroon0569w-grc-41-174-94-67-255.dsl.bell.ca.59827: Flags [P.], seq 477:513, ack 144, win 5006, options [nop,nop,TS val 95960215 ecr 2197170125], length 36
18:18:42.647031 IP bras-base-toroon0569w-grc-41-174-94-67-255.dsl.bell.ca.59827 > lamp-ubuntu-s-1vcpu-1gb-tor1-01.ssh: Flags [.], ack 513, win 2048, options [nop,nop,TS val 2197170135 ecr 95960215], length 0
18:18:42.654979 IP bras-base-toroon0569w-grc-41-174-94-67-255.dsl.bell.ca.59827 > lamp-ubuntu-s-1vcpu-1gb-tor1-01.ssh: Flags [P.], seq 144:180, ack 513, win 2048, options [nop,nop,TS val 2197170145 ecr 95960215], length 36
18:18:42.655177 IP lamp-ubuntu-s-1vcpu-1gb-tor1-01.ssh > bras-base-toroon0569w-grc-41-174-94-67-255.dsl.bell.ca.59827: Flags [P.], seq 513:549, ack 180, win 5006, options [nop,nop,TS val 95960235 ecr 2197170145], length 36
18:18:42.665216 IP lamp-ubuntu-s-1vcpu-1gb-tor1-01.47565 > 67.207.67.3.domain: 23103+ [1au] PTR? 122.170.184.137.in-addr.arpa. (57)
18:18:42.665891 IP bras-base-toroon0569w-grc-41-174-94-67-255.dsl.bell.ca.59827 > lamp-ubuntu-s-1vcpu-1gb-tor1-01.ssh: Flags [.], ack 549, win 2048, options [nop,nop,TS val 2197170157 ecr 95960235], length 0
18:18:42.675109 IP bras-base-toroon0569w-grc-41-174-94-67-255.dsl.bell.ca.59827 > lamp-ubuntu-s-1vcpu-1gb-tor1-01.ssh: Flags [P.], seq 180:216, ack 549, win 2048, options [nop,nop,TS val 2197170166 ecr 95960235], length 36
18:18:42.675328 IP lamp-ubuntu-s-1vcpu-1gb-tor1-01.ssh > bras-base-toroon0569w-grc-41-174-94-67-255.dsl.bell.ca.59827: Flags [P.], seq 549:585, ack 216, win 5006, options [nop,nop,TS val 95960256 ecr 2197170166], length 36
18:18:42.676991 IP 67.207.67.3.domain > lamp-ubuntu-s-1vcpu-1gb-tor1-01.47565: 23103 NXDomain 0/1/1 (124)
18:18:42.677963 IP lamp-ubuntu-s-1vcpu-1gb-tor1-01.38257 > 67.207.67.3.domain: 35316+ [1au] PTR? 255.67.94.174.in-addr.arpa. (55)
18:18:42.678136 IP lamp-ubuntu-s-1vcpu-1gb-tor1-01.56234 > 67.207.67.3.domain: 17099+ [1au] PTR? 255.67.94.174.in-addr.arpa. (55)
18:18:42.682742 IP bras-base-toroon0569w-grc-41-174-94-67-255.dsl.bell.ca.59827 > lamp-ubuntu-s-1vcpu-1gb-tor1-01.ssh: Flags [.], ack 585, win 2048, options [nop,nop,TS val 2197170173 ecr 95960256], length 0
18:18:42.685228 IP 67.207.67.3.domain > lamp-ubuntu-s-1vcpu-1gb-tor1-01.56234: 17099 1/0/1 PTR bras-base-toroon0569w-grc-41-174-94-67-255.dsl.bell.ca. (123)
18:18:42.685995 IP 67.207.67.3.domain > lamp-ubuntu-s-1vcpu-1gb-tor1-01.38257: 35316 1/0/1 PTR bras-base-toroon0569w-grc-41-174-94-67-255.dsl.bell.ca. (123)
18:18:42.686310 IP lamp-ubuntu-s-1vcpu-1gb-tor1-01.ssh > bras-base-toroon0569w-grc-41-174-94-67-255.dsl.bell.ca.59827: Flags [P.], seq 585:4717, ack 216, win 5006, options [nop,nop,TS val 95960267 ecr 2197170173], length 4132
18:18:42.686673 IP lamp-ubuntu-s-1vcpu-1gb-tor1-01.ssh > bras-base-toroon0569w-grc-41-174-94-67-255.dsl.bell.ca.59827: Flags [P.], seq 4717:5089, ack 216, win 5006, options [nop,nop,TS val 95960267 ecr 2197170173], length 372
18:18:42.695138 IP bras-base-toroon0569w-grc-41-174-94-67-255.dsl.bell.ca.59827 > lamp-ubuntu-s-1vcpu-1gb-tor1-01.ssh: Flags [P.], seq 216:252, ack 585, win 2048, options [nop,nop,TS val 2197170186 ecr 95960256], length 36
18:18:42.695354 IP lamp-ubuntu-s-1vcpu-1gb-tor1-01.ssh > bras-base-toroon0569w-grc-41-174-94-67-255.dsl.bell.ca.59827: Flags [P.], seq 5089:5125, ack 252, win 5006, options [nop,nop,TS val 95960276 ecr 2197170186], length 36
18:18:42.696129 IP bras-base-toroon0569w-grc-41-174-94-67-255.dsl.bell.ca.59827 > lamp-ubuntu-s-1vcpu-1gb-tor1-01.ssh: Flags [.], ack 5089, win 1978, options [nop,nop,TS val 2197170187 ecr 95960267], length 0
18:18:42.697625 IP bras-base-toroon0569w-grc-41-174-94-67-255.dsl.bell.ca.59827 > lamp-ubuntu-s-1vcpu-1gb-tor1-01.ssh: Flags [.], ack 5089, win 2048, options [nop,nop,TS val 2197170187 ecr 95960267], length 0
18:18:42.704617 IP bras-base-toroon0569w-grc-41-174-94-67-255.dsl.bell.ca.59827 > lamp-ubuntu-s-1vcpu-1gb-tor1-01.ssh: Flags [.], ack 5125, win 2048, options [nop,nop,TS val 2197170195 ecr 95960276], length 0
18:18:42.717263 IP bras-base-toroon0569w-grc-41-174-94-67-255.dsl.bell.ca.59827 > lamp-ubuntu-s-1vcpu-1gb-tor1-01.ssh: Flags [P.], seq 252:288, ack 5125, win 2048, options [nop,nop,TS val 2197170208 ecr 95960276], length 36
18:18:42.717485 IP lamp-ubuntu-s-1vcpu-1gb-tor1-01.ssh > bras-base-toroon0569w-grc-41-174-94-67-255.dsl.bell.ca.59827: Flags [P.], seq 5125:5161, ack 288, win 5006, options [nop,nop,TS val 95960298 ecr 2197170208], length 36
18:18:42.725896 IP bras-base-toroon0569w-grc-41-174-94-67-255.dsl.bell.ca.59827 > lamp-ubuntu-s-1vcpu-1gb-tor1-01.ssh: Flags [.], ack 5161, win 2048, options [nop,nop,TS val 2197170216 ecr 95960298], length 0
18:18:42.738346 IP bras-base-toroon0569w-grc-41-174-94-67-255.dsl.bell.ca.59827 > lamp-ubuntu-s-1vcpu-1gb-tor1-01.ssh: Flags [P.], seq 288:324, ack 5161, win 2048, options [nop,nop,TS val 2197170228 ecr 95960298], length 36
18:18:42.738553 IP lamp-ubuntu-s-1vcpu-1gb-tor1-01.ssh > bras-base-toroon0569w-grc-41-174-94-67-255.dsl.bell.ca.59827: Flags [P.], seq 5161:5197, ack 324, win 5006, options [nop,nop,TS val 95960319 ecr 2197170228], length 36
18:18:42.750264 IP bras-base-toroon0569w-grc-41-174-94-67-255.dsl.bell.ca.59827 > lamp-ubuntu-s-1vcpu-1gb-tor1-01.ssh: Flags [.], ack 5197, win 2048, options [nop,nop,TS val 2197170240 ecr 95960319], length 0
18:18:42.760884 IP bras-base-toroon0569w-grc-41-174-94-67-255.dsl.bell.ca.59827 > lamp-ubuntu-s-1vcpu-1gb-tor1-01.ssh: Flags [P.], seq 324:360, ack 5197, win 2048, options [nop,nop,TS val 2197170251 ecr 95960319], length 36
18:18:42.761060 IP lamp-ubuntu-s-1vcpu-1gb-tor1-01.ssh > bras-base-toroon0569w-grc-41-174-94-67-255.dsl.bell.ca.59827: Flags [P.], seq 5197:5233, ack 360, win 5006, options [nop,nop,TS val 95960341 ecr 2197170251], length 36
18:18:42.768655 IP lamp-ubuntu-s-1vcpu-1gb-tor1-01.47538 > 67.207.67.3.domain: 38934+ [1au] PTR? 3.67.207.67.in-addr.arpa. (53)
18:18:42.768824 IP lamp-ubuntu-s-1vcpu-1gb-tor1-01.54500 > 67.207.67.3.domain: 34203+ [1au] PTR? 3.67.207.67.in-addr.arpa. (53)
18:18:42.769726 IP 67.207.67.3.domain > lamp-ubuntu-s-1vcpu-1gb-tor1-01.47538: 38934 NXDomain 0/1/1 (120)
18:18:42.769765 IP 67.207.67.3.domain > lamp-ubuntu-s-1vcpu-1gb-tor1-01.54500: 34203 NXDomain 0/1/1 (120)
18:18:42.774504 IP bras-base-toroon0569w-grc-41-174-94-67-255.dsl.bell.ca.59827 > lamp-ubuntu-s-1vcpu-1gb-tor1-01.ssh: Flags [.], ack 5233, win 2048, options [nop,nop,TS val 2197170264 ecr 95960341], length 0
18:18:42.782542 IP bras-base-toroon0569w-grc-41-174-94-67-255.dsl.bell.ca.59827 > lamp-ubuntu-s-1vcpu-1gb-tor1-01.ssh: Flags [P.], seq 360:396, ack 5233, win 2048, options [nop,nop,TS val 2197170273 ecr 95960341], length 36
18:18:42.782886 IP lamp-ubuntu-s-1vcpu-1gb-tor1-01.ssh > bras-base-toroon0569w-grc-41-174-94-67-255.dsl.bell.ca.59827: Flags [P.], seq 5233:5269, ack 396, win 5006, options [nop,nop,TS val 95960363 ecr 2197170273], length 36
18:18:42.793250 IP bras-base-toroon0569w-grc-41-174-94-67-255.dsl.bell.ca.59827 > lamp-ubuntu-s-1vcpu-1gb-tor1-01.ssh: Flags [.], ack 5269, win 2048, options [nop,nop,TS val 2197170283 ecr 95960363], length 0
18:18:42.805489 IP bras-base-toroon0569w-grc-41-174-94-67-255.dsl.bell.ca.59827 > lamp-ubuntu-s-1vcpu-1gb-tor1-01.ssh: Flags [P.], seq 396:432, ack 5269, win 2048, options [nop,nop,TS val 2197170296 ecr 95960363], length 36
18:18:42.805698 IP lamp-ubuntu-s-1vcpu-1gb-tor1-01.ssh > bras-base-toroon0569w-grc-41-174-94-67-255.dsl.bell.ca.59827: Flags [P.], seq 5269:5305, ack 432, win 5006, options [nop,nop,TS val 95960386 ecr 2197170296], length 36
18:18:42.815989 IP bras-base-toroon0569w-grc-41-174-94-67-255.dsl.bell.ca.59827 > lamp-ubuntu-s-1vcpu-1gb-tor1-01.ssh: Flags [.], ack 5305, win 2048, options [nop,nop,TS val 2197170306 ecr 95960386], length 0
18:18:42.827850 IP bras-base-toroon0569w-grc-41-174-94-67-255.dsl.bell.ca.59827 > lamp-ubuntu-s-1vcpu-1gb-tor1-01.ssh: Flags [P.], seq 432:468, ack 5305, win 2048, options [nop,nop,TS val 2197170318 ecr 95960386], length 36
18:18:42.828018 IP lamp-ubuntu-s-1vcpu-1gb-tor1-01.ssh > bras-base-toroon0569w-grc-41-174-94-67-255.dsl.bell.ca.59827: Flags [P.], seq 5305:5341, ack 468, win 5006, options [nop,nop,TS val 95960408 ecr 2197170318], length 36
18:18:42.836375 IP bras-base-toroon0569w-grc-41-174-94-67-255.dsl.bell.ca.59827 > lamp-ubuntu-s-1vcpu-1gb-tor1-01.ssh: Flags [.], ack 5341, win 2048, options [nop,nop,TS val 2197170327 ecr 95960408], length 0
18:18:42.851258 IP bras-base-toroon0569w-grc-41-174-94-67-255.dsl.bell.ca.59827 > lamp-ubuntu-s-1vcpu-1gb-tor1-01.ssh: Flags [P.], seq 468:504, ack 5341, win 2048, options [nop,nop,TS val 2197170341 ecr 95960408], length 36
18:18:42.851485 IP lamp-ubuntu-s-1vcpu-1gb-tor1-01.ssh > bras-base-toroon0569w-grc-41-174-94-67-255.dsl.bell.ca.59827: Flags [P.], seq 5341:5377, ack 504, win 5006, options [nop,nop,TS val 95960432 ecr 2197170341], length 36
18:18:42.861012 IP bras-base-toroon0569w-grc-41-174-94-67-255.dsl.bell.ca.59827 > lamp-ubuntu-s-1vcpu-1gb-tor1-01.ssh: Flags [.], ack 5377, win 2048, options [nop,nop,TS val 2197170351 ecr 95960432], length 0
18:18:42.874888 IP bras-base-toroon0569w-grc-41-174-94-67-255.dsl.bell.ca.59827 > lamp-ubuntu-s-1vcpu-1gb-tor1-01.ssh: Flags [P.], seq 504:540, ack 5377, win 2048, options [nop,nop,TS val 2197170364 ecr 95960432], length 36
18:18:42.875093 IP lamp-ubuntu-s-1vcpu-1gb-tor1-01.ssh > bras-base-toroon0569w-grc-41-174-94-67-255.dsl.bell.ca.59827: Flags [P.], seq 5377:5413, ack 540, win 5006, options [nop,nop,TS val 95960455 ecr 2197170364], length 36
18:18:42.887262 IP bras-base-toroon0569w-grc-41-174-94-67-255.dsl.bell.ca.59827 > lamp-ubuntu-s-1vcpu-1gb-tor1-01.ssh: Flags [.], ack 5413, win 2048, options [nop,nop,TS val 2197170378 ecr 95960455], length 0
18:18:42.894624 IP bras-base-toroon0569w-grc-41-174-94-67-255.dsl.bell.ca.59827 > lamp-ubuntu-s-1vcpu-1gb-tor1-01.ssh: Flags [P.], seq 540:576, ack 5413, win 2048, options [nop,nop,TS val 2197170384 ecr 95960455], length 36
18:18:42.894804 IP lamp-ubuntu-s-1vcpu-1gb-tor1-01.ssh > bras-base-toroon0569w-grc-41-174-94-67-255.dsl.bell.ca.59827: Flags [P.], seq 5413:5449, ack 576, win 5006, options [nop,nop,TS val 95960475 ecr 2197170384], length 36
18:18:42.903008 IP bras-base-toroon0569w-grc-41-174-94-67-255.dsl.bell.ca.59827 > lamp-ubuntu-s-1vcpu-1gb-tor1-01.ssh: Flags [.], ack 5449, win 2048, options [nop,nop,TS val 2197170394 ecr 95960475], length 0
18:18:42.914985 IP bras-base-toroon0569w-grc-41-174-94-67-255.dsl.bell.ca.59827 > lamp-ubuntu-s-1vcpu-1gb-tor1-01.ssh: Flags [P.], seq 576:612, ack 5449, win 2048, options [nop,nop,TS val 2197170406 ecr 95960475], length 36
18:18:42.915173 IP lamp-ubuntu-s-1vcpu-1gb-tor1-01.ssh > bras-base-toroon0569w-grc-41-174-94-67-255.dsl.bell.ca.59827: Flags [P.], seq 5449:5485, ack 612, win 5006, options [nop,nop,TS val 95960495 ecr 2197170406], length 36
18:18:42.923228 IP bras-base-toroon0569w-grc-41-174-94-67-255.dsl.bell.ca.59827 > lamp-ubuntu-s-1vcpu-1gb-tor1-01.ssh: Flags [.], ack 5485, win 2048, options [nop,nop,TS val 2197170414 ecr 95960495], length 0
18:18:42.935640 IP bras-base-toroon0569w-grc-41-174-94-67-255.dsl.bell.ca.59827 > lamp-ubuntu-s-1vcpu-1gb-tor1-01.ssh: Flags [P.], seq 612:648, ack 5485, win 2048, options [nop,nop,TS val 2197170426 ecr 95960495], length 36
18:18:42.935802 IP lamp-ubuntu-s-1vcpu-1gb-tor1-01.ssh > bras-base-toroon0569w-grc-41-174-94-67-255.dsl.bell.ca.59827: Flags [P.], seq 5485:5521, ack 648, win 5006, options [nop,nop,TS val 95960516 ecr 2197170426], length 36
18:18:42.945380 IP bras-base-toroon0569w-grc-41-174-94-67-255.dsl.bell.ca.59827 > lamp-ubuntu-s-1vcpu-1gb-tor1-01.ssh: Flags [.], ack 5521, win 2048, options [nop,nop,TS val 2197170435 ecr 95960516], length 0
18:18:42.957100 IP bras-base-toroon0569w-grc-41-174-94-67-255.dsl.bell.ca.59827 > lamp-ubuntu-s-1vcpu-1gb-tor1-01.ssh: Flags [P.], seq 648:684, ack 5521, win 2048, options [nop,nop,TS val 2197170448 ecr 95960516], length 36
18:18:42.957247 IP lamp-ubuntu-s-1vcpu-1gb-tor1-01.ssh > bras-base-toroon0569w-grc-41-174-94-67-255.dsl.bell.ca.59827: Flags [P.], seq 5521:5557, ack 684, win 5006, options [nop,nop,TS val 95960537 ecr 2197170448], length 36
18:18:42.969623 IP bras-base-toroon0569w-grc-41-174-94-67-255.dsl.bell.ca.59827 > lamp-ubuntu-s-1vcpu-1gb-tor1-01.ssh: Flags [.], ack 5557, win 2048, options [nop,nop,TS val 2197170456 ecr 95960537], length 0
18:18:42.981372 IP bras-base-toroon0569w-grc-41-174-94-67-255.dsl.bell.ca.59827 > lamp-ubuntu-s-1vcpu-1gb-tor1-01.ssh: Flags [P.], seq 684:720, ack 5557, win 2048, options [nop,nop,TS val 2197170469 ecr 95960537], length 36
18:18:42.981537 IP lamp-ubuntu-s-1vcpu-1gb-tor1-01.ssh > bras-base-toroon0569w-grc-41-174-94-67-255.dsl.bell.ca.59827: Flags [P.], seq 5557:5593, ack 720, win 5006, options [nop,nop,TS val 95960562 ecr 2197170469], length 36
18:18:42.994141 IP bras-base-toroon0569w-grc-41-174-94-67-255.dsl.bell.ca.59827 > lamp-ubuntu-s-1vcpu-1gb-tor1-01.ssh: Flags [.], ack 5593, win 2048, options [nop,nop,TS val 2197170484 ecr 95960562], length 0
18:18:42.999527 IP bras-base-toroon0569w-grc-41-174-94-67-255.dsl.bell.ca.59827 > lamp-ubuntu-s-1vcpu-1gb-tor1-01.ssh: Flags [P.], seq 720:756, ack 5593, win 2048, options [nop,nop,TS val 2197170490 ecr 95960562], length 36
18:18:42.999712 IP lamp-ubuntu-s-1vcpu-1gb-tor1-01.ssh > bras-base-toroon0569w-grc-41-174-94-67-255.dsl.bell.ca.59827: Flags [P.], seq 5593:5629, ack 756, win 5006, options [nop,nop,TS val 95960580 ecr 2197170490], length 36
18:18:43.007112 IP bras-base-toroon0569w-grc-41-174-94-67-255.dsl.bell.ca.59827 > lamp-ubuntu-s-1vcpu-1gb-tor1-01.ssh: Flags [.], ack 5629, win 2048, options [nop,nop,TS val 2197170498 ecr 95960580], length 0
18:18:43.022118 IP bras-base-toroon0569w-grc-41-174-94-67-255.dsl.bell.ca.59827 > lamp-ubuntu-s-1vcpu-1gb-tor1-01.ssh: Flags [P.], seq 756:792, ack 5629, win 2048, options [nop,nop,TS val 2197170513 ecr 95960580], length 36
18:18:43.022316 IP lamp-ubuntu-s-1vcpu-1gb-tor1-01.ssh > bras-base-toroon0569w-grc-41-174-94-67-255.dsl.bell.ca.59827: Flags [P.], seq 5629:5665, ack 792, win 5006, options [nop,nop,TS val 95960603 ecr 2197170513], length 36
18:18:43.029934 IP bras-base-toroon0569w-grc-41-174-94-67-255.dsl.bell.ca.59827 > lamp-ubuntu-s-1vcpu-1gb-tor1-01.ssh: Flags [.], ack 5665, win 2048, options [nop,nop,TS val 2197170521 ecr 95960603], length 0
18:18:43.043974 IP bras-base-toroon0569w-grc-41-174-94-67-255.dsl.bell.ca.59827 > lamp-ubuntu-s-1vcpu-1gb-tor1-01.ssh: Flags [P.], seq 792:828, ack 5665, win 2048, options [nop,nop,TS val 2197170534 ecr 95960603], length 36
18:18:43.044139 IP lamp-ubuntu-s-1vcpu-1gb-tor1-01.ssh > bras-base-toroon0569w-grc-41-174-94-67-255.dsl.bell.ca.59827: Flags [P.], seq 5665:5701, ack 828, win 5006, options [nop,nop,TS val 95960624 ecr 2197170534], length 36
18:18:43.052150 IP bras-base-toroon0569w-grc-41-174-94-67-255.dsl.bell.ca.59827 > lamp-ubuntu-s-1vcpu-1gb-tor1-01.ssh: Flags [.], ack 5701, win 2048, options [nop,nop,TS val 2197170543 ecr 95960624], length 0
18:18:43.064195 IP bras-base-toroon0569w-grc-41-174-94-67-255.dsl.bell.ca.59827 > lamp-ubuntu-s-1vcpu-1gb-tor1-01.ssh: Flags [P.], seq 828:864, ack 5701, win 2048, options [nop,nop,TS val 2197170555 ecr 95960624], length 36
18:18:43.064416 IP lamp-ubuntu-s-1vcpu-1gb-tor1-01.ssh > bras-base-toroon0569w-grc-41-174-94-67-255.dsl.bell.ca.59827: Flags [P.], seq 5701:5737, ack 864, win 5006, options [nop,nop,TS val 95960645 ecr 2197170555], length 36
18:18:43.071911 IP bras-base-toroon0569w-grc-41-174-94-67-255.dsl.bell.ca.59827 > lamp-ubuntu-s-1vcpu-1gb-tor1-01.ssh: Flags [.], ack 5737, win 2048, options [nop,nop,TS val 2197170563 ecr 95960645], length 0
18:18:43.085073 IP bras-base-toroon0569w-grc-41-174-94-67-255.dsl.bell.ca.59827 > lamp-ubuntu-s-1vcpu-1gb-tor1-01.ssh: Flags [P.], seq 864:900, ack 5737, win 2048, options [nop,nop,TS val 2197170576 ecr 95960645], length 36
18:18:43.085309 IP lamp-ubuntu-s-1vcpu-1gb-tor1-01.ssh > bras-base-toroon0569w-grc-41-174-94-67-255.dsl.bell.ca.59827: Flags [P.], seq 5737:5773, ack 900, win 5006, options [nop,nop,TS val 95960666 ecr 2197170576], length 36
18:18:43.099907 IP bras-base-toroon0569w-grc-41-174-94-67-255.dsl.bell.ca.59827 > lamp-ubuntu-s-1vcpu-1gb-tor1-01.ssh: Flags [.], ack 5773, win 2048, options [nop,nop,TS val 2197170591 ecr 95960666], length 0
18:18:43.104373 IP bras-base-toroon0569w-grc-41-174-94-67-255.dsl.bell.ca.59827 > lamp-ubuntu-s-1vcpu-1gb-tor1-01.ssh: Flags [P.], seq 900:936, ack 5773, win 2048, options [nop,nop,TS val 2197170595 ecr 95960666], length 36
18:18:43.104548 IP lamp-ubuntu-s-1vcpu-1gb-tor1-01.ssh > bras-base-toroon0569w-grc-41-174-94-67-255.dsl.bell.ca.59827: Flags [P.], seq 5773:5809, ack 936, win 5006, options [nop,nop,TS val 95960685 ecr 2197170595], length 36
18:18:43.113333 IP bras-base-toroon0569w-grc-41-174-94-67-255.dsl.bell.ca.59827 > lamp-ubuntu-s-1vcpu-1gb-tor1-01.ssh: Flags [.], ack 5809, win 2048, options [nop,nop,TS val 2197170604 ecr 95960685], length 0
18:18:43.127856 IP bras-base-toroon0569w-grc-41-174-94-67-255.dsl.bell.ca.59827 > lamp-ubuntu-s-1vcpu-1gb-tor1-01.ssh: Flags [P.], seq 936:972, ack 5809, win 2048, options [nop,nop,TS val 2197170618 ecr 95960685], length 36
18:18:43.128049 IP lamp-ubuntu-s-1vcpu-1gb-tor1-01.ssh > bras-base-toroon0569w-grc-41-174-94-67-255.dsl.bell.ca.59827: Flags [P.], seq 5809:5845, ack 972, win 5006, options [nop,nop,TS val 95960708 ecr 2197170618], length 36
18:18:43.136496 IP bras-base-toroon0569w-grc-41-174-94-67-255.dsl.bell.ca.59827 > lamp-ubuntu-s-1vcpu-1gb-tor1-01.ssh: Flags [.], ack 5845, win 2048, options [nop,nop,TS val 2197170627 ecr 95960708], length 0
18:18:43.149624 IP bras-base-toroon0569w-grc-41-174-94-67-255.dsl.bell.ca.59827 > lamp-ubuntu-s-1vcpu-1gb-tor1-01.ssh: Flags [P.], seq 972:1008, ack 5845, win 2048, options [nop,nop,TS val 2197170640 ecr 95960708], length 36
18:18:43.149838 IP lamp-ubuntu-s-1vcpu-1gb-tor1-01.ssh > bras-base-toroon0569w-grc-41-174-94-67-255.dsl.bell.ca.59827: Flags [P.], seq 5845:5881, ack 1008, win 5006, options [nop,nop,TS val 95960730 ecr 2197170640], length 36
18:18:43.159261 IP bras-base-toroon0569w-grc-41-174-94-67-255.dsl.bell.ca.59827 > lamp-ubuntu-s-1vcpu-1gb-tor1-01.ssh: Flags [.], ack 5881, win 2048, options [nop,nop,TS val 2197170650 ecr 95960730], length 0
18:18:43.171261 IP bras-base-toroon0569w-grc-41-174-94-67-255.dsl.bell.ca.59827 > lamp-ubuntu-s-1vcpu-1gb-tor1-01.ssh: Flags [P.], seq 1008:1044, ack 5881, win 2048, options [nop,nop,TS val 2197170661 ecr 95960730], length 36
18:18:43.171430 IP lamp-ubuntu-s-1vcpu-1gb-tor1-01.ssh > bras-base-toroon0569w-grc-41-174-94-67-255.dsl.bell.ca.59827: Flags [P.], seq 5881:5917, ack 1044, win 5006, options [nop,nop,TS val 95960752 ecr 2197170661], length 36
18:18:43.181150 IP bras-base-toroon0569w-grc-41-174-94-67-255.dsl.bell.ca.59827 > lamp-ubuntu-s-1vcpu-1gb-tor1-01.ssh: Flags [.], ack 5917, win 2048, options [nop,nop,TS val 2197170671 ecr 95960752], length 0
18:18:43.191839 IP bras-base-toroon0569w-grc-41-174-94-67-255.dsl.bell.ca.59827 > lamp-ubuntu-s-1vcpu-1gb-tor1-01.ssh: Flags [P.], seq 1044:1080, ack 5917, win 2048, options [nop,nop,TS val 2197170683 ecr 95960752], length 36
18:18:43.192025 IP lamp-ubuntu-s-1vcpu-1gb-tor1-01.ssh > bras-base-toroon0569w-grc-41-174-94-67-255.dsl.bell.ca.59827: Flags [P.], seq 5917:5953, ack 1080, win 5006, options [nop,nop,TS val 95960772 ecr 2197170683], length 36
18:18:43.208977 IP bras-base-toroon0569w-grc-41-174-94-67-255.dsl.bell.ca.59827 > lamp-ubuntu-s-1vcpu-1gb-tor1-01.ssh: Flags [.], ack 5953, win 2048, options [nop,nop,TS val 2197170700 ecr 95960772], length 0
18:18:43.210927 IP bras-base-toroon0569w-grc-41-174-94-67-255.dsl.bell.ca.59827 > lamp-ubuntu-s-1vcpu-1gb-tor1-01.ssh: Flags [P.], seq 1080:1116, ack 5953, win 2048, options [nop,nop,TS val 2197170702 ecr 95960772], length 36
18:18:43.211079 IP lamp-ubuntu-s-1vcpu-1gb-tor1-01.ssh > bras-base-toroon0569w-grc-41-174-94-67-255.dsl.bell.ca.59827: Flags [P.], seq 5953:5989, ack 1116, win 5006, options [nop,nop,TS val 95960791 ecr 2197170702], length 36
18:18:43.220246 IP bras-base-toroon0569w-grc-41-174-94-67-255.dsl.bell.ca.59827 > lamp-ubuntu-s-1vcpu-1gb-tor1-01.ssh: Flags [.], ack 5989, win 2048, options [nop,nop,TS val 2197170711 ecr 95960791], length 0
18:18:43.234419 IP bras-base-toroon0569w-grc-41-174-94-67-255.dsl.bell.ca.59827 > lamp-ubuntu-s-1vcpu-1gb-tor1-01.ssh: Flags [P.], seq 1116:1152, ack 5989, win 2048, options [nop,nop,TS val 2197170725 ecr 95960791], length 36
18:18:43.234608 IP lamp-ubuntu-s-1vcpu-1gb-tor1-01.ssh > bras-base-toroon0569w-grc-41-174-94-67-255.dsl.bell.ca.59827: Flags [P.], seq 5989:6025, ack 1152, win 5006, options [nop,nop,TS val 95960815 ecr 2197170725], length 36
18:18:43.246460 IP bras-base-toroon0569w-grc-41-174-94-67-255.dsl.bell.ca.59827 > lamp-ubuntu-s-1vcpu-1gb-tor1-01.ssh: Flags [.], ack 6025, win 2048, options [nop,nop,TS val 2197170737 ecr 95960815], length 0
18:18:43.254954 IP bras-base-toroon0569w-grc-41-174-94-67-255.dsl.bell.ca.59827 > lamp-ubuntu-s-1vcpu-1gb-tor1-01.ssh: Flags [P.], seq 1152:1188, ack 6025, win 2048, options [nop,nop,TS val 2197170745 ecr 95960815], length 36
18:18:43.255114 IP lamp-ubuntu-s-1vcpu-1gb-tor1-01.ssh > bras-base-toroon0569w-grc-41-174-94-67-255.dsl.bell.ca.59827: Flags [P.], seq 6025:6061, ack 1188, win 5006, options [nop,nop,TS val 95960835 ecr 2197170745], length 36
18:18:43.264841 IP bras-base-toroon0569w-grc-41-174-94-67-255.dsl.bell.ca.59827 > lamp-ubuntu-s-1vcpu-1gb-tor1-01.ssh: Flags [.], ack 6061, win 2048, options [nop,nop,TS val 2197170755 ecr 95960835], length 0
18:18:43.277391 IP bras-base-toroon0569w-grc-41-174-94-67-255.dsl.bell.ca.59827 > lamp-ubuntu-s-1vcpu-1gb-tor1-01.ssh: Flags [P.], seq 1188:1224, ack 6061, win 2048, options [nop,nop,TS val 2197170766 ecr 95960835], length 36
18:18:43.277592 IP lamp-ubuntu-s-1vcpu-1gb-tor1-01.ssh > bras-base-toroon0569w-grc-41-174-94-67-255.dsl.bell.ca.59827: Flags [P.], seq 6061:6097, ack 1224, win 5006, options [nop,nop,TS val 95960858 ecr 2197170766], length 36
18:18:43.290354 IP bras-base-toroon0569w-grc-41-174-94-67-255.dsl.bell.ca.59827 > lamp-ubuntu-s-1vcpu-1gb-tor1-01.ssh: Flags [.], ack 6097, win 2048, options [nop,nop,TS val 2197170779 ecr 95960858], length 0
18:18:43.296705 IP bras-base-toroon0569w-grc-41-174-94-67-255.dsl.bell.ca.59827 > lamp-ubuntu-s-1vcpu-1gb-tor1-01.ssh: Flags [P.], seq 1224:1260, ack 6097, win 2048, options [nop,nop,TS val 2197170786 ecr 95960858], length 36
18:18:43.296879 IP lamp-ubuntu-s-1vcpu-1gb-tor1-01.ssh > bras-base-toroon0569w-grc-41-174-94-67-255.dsl.bell.ca.59827: Flags [P.], seq 6097:6133, ack 1260, win 5006, options [nop,nop,TS val 95960877 ecr 2197170786], length 36
18:18:43.307931 IP bras-base-toroon0569w-grc-41-174-94-67-255.dsl.bell.ca.59827 > lamp-ubuntu-s-1vcpu-1gb-tor1-01.ssh: Flags [.], ack 6133, win 2048, options [nop,nop,TS val 2197170798 ecr 95960877], length 0
18:18:43.317442 IP bras-base-toroon0569w-grc-41-174-94-67-255.dsl.bell.ca.59827 > lamp-ubuntu-s-1vcpu-1gb-tor1-01.ssh: Flags [P.], seq 1260:1296, ack 6133, win 2048, options [nop,nop,TS val 2197170808 ecr 95960877], length 36
18:18:43.317590 IP lamp-ubuntu-s-1vcpu-1gb-tor1-01.ssh > bras-base-toroon0569w-grc-41-174-94-67-255.dsl.bell.ca.59827: Flags [P.], seq 6133:6169, ack 1296, win 5006, options [nop,nop,TS val 95960898 ecr 2197170808], length 36
18:18:43.329983 IP bras-base-toroon0569w-grc-41-174-94-67-255.dsl.bell.ca.59827 > lamp-ubuntu-s-1vcpu-1gb-tor1-01.ssh: Flags [.], ack 6169, win 2048, options [nop,nop,TS val 2197170821 ecr 95960898], length 0
18:18:43.339507 IP bras-base-toroon0569w-grc-41-174-94-67-255.dsl.bell.ca.59827 > lamp-ubuntu-s-1vcpu-1gb-tor1-01.ssh: Flags [P.], seq 1296:1332, ack 6169, win 2048, options [nop,nop,TS val 2197170830 ecr 95960898], length 36
18:18:43.339713 IP lamp-ubuntu-s-1vcpu-1gb-tor1-01.ssh > bras-base-toroon0569w-grc-41-174-94-67-255.dsl.bell.ca.59827: Flags [P.], seq 6169:6205, ack 1332, win 5006, options [nop,nop,TS val 95960920 ecr 2197170830], length 36
18:18:43.349328 IP bras-base-toroon0569w-grc-41-174-94-67-255.dsl.bell.ca.59827 > lamp-ubuntu-s-1vcpu-1gb-tor1-01.ssh: Flags [.], ack 6205, win 2048, options [nop,nop,TS val 2197170839 ecr 95960920], length 0
18:18:43.357700 IP bras-base-toroon0569w-grc-41-174-94-67-255.dsl.bell.ca.59827 > lamp-ubuntu-s-1vcpu-1gb-tor1-01.ssh: Flags [P.], seq 1332:1368, ack 6205, win 2048, options [nop,nop,TS val 2197170849 ecr 95960920], length 36
18:18:43.357873 IP lamp-ubuntu-s-1vcpu-1gb-tor1-01.ssh > bras-base-toroon0569w-grc-41-174-94-67-255.dsl.bell.ca.59827: Flags [P.], seq 6205:6241, ack 1368, win 5006, options [nop,nop,TS val 95960938 ecr 2197170849], length 36
18:18:43.368251 IP bras-base-toroon0569w-grc-41-174-94-67-255.dsl.bell.ca.59827 > lamp-ubuntu-s-1vcpu-1gb-tor1-01.ssh: Flags [.], ack 6241, win 2048, options [nop,nop,TS val 2197170859 ecr 95960938], length 0
18:18:43.378866 IP bras-base-toroon0569w-grc-41-174-94-67-255.dsl.bell.ca.59827 > lamp-ubuntu-s-1vcpu-1gb-tor1-01.ssh: Flags [P.], seq 1368:1404, ack 6241, win 2048, options [nop,nop,TS val 2197170869 ecr 95960938], length 36
18:18:43.379031 IP lamp-ubuntu-s-1vcpu-1gb-tor1-01.ssh > bras-base-toroon0569w-grc-41-174-94-67-255.dsl.bell.ca.59827: Flags [P.], seq 6241:6277, ack 1404, win 5006, options [nop,nop,TS val 95960959 ecr 2197170869], length 36
18:18:43.387642 IP bras-base-toroon0569w-grc-41-174-94-67-255.dsl.bell.ca.59827 > lamp-ubuntu-s-1vcpu-1gb-tor1-01.ssh: Flags [.], ack 6277, win 2048, options [nop,nop,TS val 2197170878 ecr 95960959], length 0
18:18:43.400876 IP bras-base-toroon0569w-grc-41-174-94-67-255.dsl.bell.ca.59827 > lamp-ubuntu-s-1vcpu-1gb-tor1-01.ssh: Flags [P.], seq 1404:1440, ack 6277, win 2048, options [nop,nop,TS val 2197170891 ecr 95960959], length 36
18:18:43.401048 IP lamp-ubuntu-s-1vcpu-1gb-tor1-01.ssh > bras-base-toroon0569w-grc-41-174-94-67-255.dsl.bell.ca.59827: Flags [P.], seq 6277:6313, ack 1440, win 5006, options [nop,nop,TS val 95960981 ecr 2197170891], length 36
18:18:43.409944 IP bras-base-toroon0569w-grc-41-174-94-67-255.dsl.bell.ca.59827 > lamp-ubuntu-s-1vcpu-1gb-tor1-01.ssh: Flags [.], ack 6313, win 2048, options [nop,nop,TS val 2197170900 ecr 95960981], length 0
18:18:43.422352 IP bras-base-toroon0569w-grc-41-174-94-67-255.dsl.bell.ca.59827 > lamp-ubuntu-s-1vcpu-1gb-tor1-01.ssh: Flags [P.], seq 1440:1476, ack 6313, win 2048, options [nop,nop,TS val 2197170912 ecr 95960981], length 36
18:18:43.422555 IP lamp-ubuntu-s-1vcpu-1gb-tor1-01.ssh > bras-base-toroon0569w-grc-41-174-94-67-255.dsl.bell.ca.59827: Flags [P.], seq 6313:6349, ack 1476, win 5006, options [nop,nop,TS val 95961003 ecr 2197170912], length 36
18:18:43.436536 IP bras-base-toroon0569w-grc-41-174-94-67-255.dsl.bell.ca.59827 > lamp-ubuntu-s-1vcpu-1gb-tor1-01.ssh: Flags [.], ack 6349, win 2048, options [nop,nop,TS val 2197170926 ecr 95961003], length 0
18:18:43.443037 IP bras-base-toroon0569w-grc-41-174-94-67-255.dsl.bell.ca.59827 > lamp-ubuntu-s-1vcpu-1gb-tor1-01.ssh: Flags [P.], seq 1476:1512, ack 6349, win 2048, options [nop,nop,TS val 2197170933 ecr 95961003], length 36
18:18:43.443236 IP lamp-ubuntu-s-1vcpu-1gb-tor1-01.ssh > bras-base-toroon0569w-grc-41-174-94-67-255.dsl.bell.ca.59827: Flags [P.], seq 6349:6385, ack 1512, win 5006, options [nop,nop,TS val 95961023 ecr 2197170933], length 36
18:18:43.454152 IP bras-base-toroon0569w-grc-41-174-94-67-255.dsl.bell.ca.59827 > lamp-ubuntu-s-1vcpu-1gb-tor1-01.ssh: Flags [.], ack 6385, win 2048, options [nop,nop,TS val 2197170943 ecr 95961023], length 0
18:18:43.464610 IP bras-base-toroon0569w-grc-41-174-94-67-255.dsl.bell.ca.59827 > lamp-ubuntu-s-1vcpu-1gb-tor1-01.ssh: Flags [P.], seq 1512:1548, ack 6385, win 2048, options [nop,nop,TS val 2197170954 ecr 95961023], length 36
18:18:43.464776 IP lamp-ubuntu-s-1vcpu-1gb-tor1-01.ssh > bras-base-toroon0569w-grc-41-174-94-67-255.dsl.bell.ca.59827: Flags [P.], seq 6385:6421, ack 1548, win 5006, options [nop,nop,TS val 95961045 ecr 2197170954], length 36
18:18:43.473860 IP bras-base-toroon0569w-grc-41-174-94-67-255.dsl.bell.ca.59827 > lamp-ubuntu-s-1vcpu-1gb-tor1-01.ssh: Flags [.], ack 6421, win 2048, options [nop,nop,TS val 2197170964 ecr 95961045], length 0
18:18:43.486362 IP bras-base-toroon0569w-grc-41-174-94-67-255.dsl.bell.ca.59827 > lamp-ubuntu-s-1vcpu-1gb-tor1-01.ssh: Flags [P.], seq 1548:1584, ack 6421, win 2048, options [nop,nop,TS val 2197170976 ecr 95961045], length 36
18:18:43.486517 IP lamp-ubuntu-s-1vcpu-1gb-tor1-01.ssh > bras-base-toroon0569w-grc-41-174-94-67-255.dsl.bell.ca.59827: Flags [P.], seq 6421:6457, ack 1584, win 5006, options [nop,nop,TS val 95961067 ecr 2197170976], length 36
18:18:43.494987 IP bras-base-toroon0569w-grc-41-174-94-67-255.dsl.bell.ca.59827 > lamp-ubuntu-s-1vcpu-1gb-tor1-01.ssh: Flags [.], ack 6457, win 2048, options [nop,nop,TS val 2197170985 ecr 95961067], length 0
18:18:48.801449 IP lamp-ubuntu-s-1vcpu-1gb-tor1-01.ssh > bras-base-toroon0569w-grc-41-174-94-67-255.dsl.bell.ca.59827: Flags [P.], seq 9589:13721, ack 4716, win 5006, options [nop,nop,TS val 95966382 ecr 2197172858], length 4132
18:18:48.801642 IP lamp-ubuntu-s-1vcpu-1gb-tor1-01.ssh > bras-base-toroon0569w-grc-41-174-94-67-255.dsl.bell.ca.59827: Flags [P.], seq 13721:17853, ack 4716, win 5006, options [nop,nop,TS val 95966382 ecr 2197172858], length 4132
18:18:48.801683 IP lamp-ubuntu-s-1vcpu-1gb-tor1-01.ssh > bras-base-toroon0569w-grc-41-174-94-67-255.dsl.bell.ca.59827: Flags [P.], seq 17853:21985, ack 4716, win 5006, options [nop,nop,TS val 95966382 ecr 2197172858], length 4132
18:18:48.801725 IP lamp-ubuntu-s-1vcpu-1gb-tor1-01.ssh > bras-base-toroon0569w-grc-41-174-94-67-255.dsl.bell.ca.59827: Flags [.], seq 21985:23407, ack 4716, win 5006, options [nop,nop,TS val 95966382 ecr 2197172858], length 1422
18:18:48.826297 IP lamp-ubuntu-s-1vcpu-1gb-tor1-01.ssh > bras-base-toroon0569w-grc-41-174-94-67-255.dsl.bell.ca.59827: Flags [.], seq 23407:24829, ack 4716, win 5006, options [nop,nop,TS val 95966407 ecr 2197172858], length 1422
18:18:48.826734 IP bras-base-toroon0569w-grc-41-174-94-67-255.dsl.bell.ca.59827 > lamp-ubuntu-s-1vcpu-1gb-tor1-01.ssh: Flags [.], ack 23407, win 1833, options [nop,nop,TS val 2197176315 ecr 95966382], length 0
18:18:48.826734 IP bras-base-toroon0569w-grc-41-174-94-67-255.dsl.bell.ca.59827 > lamp-ubuntu-s-1vcpu-1gb-tor1-01.ssh: Flags [.], ack 23407, win 2048, options [nop,nop,TS val 2197176315 ecr 95966382], length 0
18:18:48.826822 IP lamp-ubuntu-s-1vcpu-1gb-tor1-01.ssh > bras-base-toroon0569w-grc-41-174-94-67-255.dsl.bell.ca.59827: Flags [P.], seq 24829:29095, ack 4716, win 5006, options [nop,nop,TS val 95966407 ecr 2197176315], length 4266
18:18:48.826836 IP lamp-ubuntu-s-1vcpu-1gb-tor1-01.ssh > bras-base-toroon0569w-grc-41-174-94-67-255.dsl.bell.ca.59827: Flags [P.], seq 29095:33361, ack 4716, win 5006, options [nop,nop,TS val 95966407 ecr 2197176315], length 4266
18:18:48.826864 IP lamp-ubuntu-s-1vcpu-1gb-tor1-01.ssh > bras-base-toroon0569w-grc-41-174-94-67-255.dsl.bell.ca.59827: Flags [P.], seq 33361:37627, ack 4716, win 5006, options [nop,nop,TS val 95966407 ecr 2197176315], length 4266
18:18:48.826877 IP lamp-ubuntu-s-1vcpu-1gb-tor1-01.ssh > bras-base-toroon0569w-grc-41-174-94-67-255.dsl.bell.ca.59827: Flags [P.], seq 37627:39413, ack 4716, win 5006, options [nop,nop,TS val 95966407 ecr 2197176315], length 1786
18:18:48.840187 IP bras-base-toroon0569w-grc-41-174-94-67-255.dsl.bell.ca.59827 > lamp-ubuntu-s-1vcpu-1gb-tor1-01.ssh: Flags [.], ack 39413, win 1798, options [nop,nop,TS val 2197176330 ecr 95966407], length 0
18:18:48.840187 IP bras-base-toroon0569w-grc-41-174-94-67-255.dsl.bell.ca.59827 > lamp-ubuntu-s-1vcpu-1gb-tor1-01.ssh: Flags [.], ack 39413, win 2048, options [nop,nop,TS val 2197176330 ecr 95966407], length 0
18:18:48.840187 IP bras-base-toroon0569w-grc-41-174-94-67-255.dsl.bell.ca.59827 > lamp-ubuntu-s-1vcpu-1gb-tor1-01.ssh: Flags [P.], seq 4716:4752, ack 39413, win 2048, options [nop,nop,TS val 2197176331 ecr 95966407], length 36
18:18:48.880341 IP lamp-ubuntu-s-1vcpu-1gb-tor1-01.ssh > bras-base-toroon0569w-grc-41-174-94-67-255.dsl.bell.ca.59827: Flags [.], ack 4752, win 5006, options [nop,nop,TS val 95966461 ecr 2197176331], length 0
18:18:48.903763 IP lamp-ubuntu-s-1vcpu-1gb-tor1-01.ssh > bras-base-toroon0569w-grc-41-174-94-67-255.dsl.bell.ca.59827: Flags [P.], seq 39413:42809, ack 4752, win 5006, options [nop,nop,TS val 95966484 ecr 2197176331], length 3396
18:18:48.911617 IP bras-base-toroon0569w-grc-41-174-94-67-255.dsl.bell.ca.59827 > lamp-ubuntu-s-1vcpu-1gb-tor1-01.ssh: Flags [.], ack 42809, win 1995, options [nop,nop,TS val 2197176402 ecr 95966484], length 0
18:18:48.911617 IP bras-base-toroon0569w-grc-41-174-94-67-255.dsl.bell.ca.59827 > lamp-ubuntu-s-1vcpu-1gb-tor1-01.ssh: Flags [.], ack 42809, win 2048, options [nop,nop,TS val 2197176402 ecr 95966484], length 0
18:18:49.007544 IP lamp-ubuntu-s-1vcpu-1gb-tor1-01.ssh > bras-base-toroon0569w-grc-41-174-94-67-255.dsl.bell.ca.59827: Flags [P.], seq 42809:43077, ack 4752, win 5006, options [nop,nop,TS val 95966588 ecr 2197176402], length 268
18:18:49.007699 IP lamp-ubuntu-s-1vcpu-1gb-tor1-01.ssh > bras-base-toroon0569w-grc-41-174-94-67-255.dsl.bell.ca.59827: Flags [P.], seq 43077:43537, ack 4752, win 5006, options [nop,nop,TS val 95966588 ecr 2197176402], length 460
18:18:49.019584 IP bras-base-toroon0569w-grc-41-174-94-67-255.dsl.bell.ca.59827 > lamp-ubuntu-s-1vcpu-1gb-tor1-01.ssh: Flags [.], ack 43537, win 2048, options [nop,nop,TS val 2197176509 ecr 95966588], length 0
18:18:49.111547 IP lamp-ubuntu-s-1vcpu-1gb-tor1-01.ssh > bras-base-toroon0569w-grc-41-174-94-67-255.dsl.bell.ca.59827: Flags [P.], seq 43537:44245, ack 4752, win 5006, options [nop,nop,TS val 95966692 ecr 2197176509], length 708
18:18:49.127555 IP bras-base-toroon0569w-grc-41-174-94-67-255.dsl.bell.ca.59827 > lamp-ubuntu-s-1vcpu-1gb-tor1-01.ssh: Flags [.], ack 44245, win 2048, options [nop,nop,TS val 2197176615 ecr 95966692], length 0
18:18:49.215535 IP lamp-ubuntu-s-1vcpu-1gb-tor1-01.ssh > bras-base-toroon0569w-grc-41-174-94-67-255.dsl.bell.ca.59827: Flags [P.], seq 44245:44513, ack 4752, win 5006, options [nop,nop,TS val 95966796 ecr 2197176615], length 268
18:18:49.215631 IP lamp-ubuntu-s-1vcpu-1gb-tor1-01.ssh > bras-base-toroon0569w-grc-41-174-94-67-255.dsl.bell.ca.59827: Flags [P.], seq 44513:44765, ack 4752, win 5006, options [nop,nop,TS val 95966796 ecr 2197176615], length 252
18:18:49.224377 IP bras-base-toroon0569w-grc-41-174-94-67-255.dsl.bell.ca.59827 > lamp-ubuntu-s-1vcpu-1gb-tor1-01.ssh: Flags [.], ack 44765, win 2048, options [nop,nop,TS val 2197176714 ecr 95966796], length 0
18:18:49.319626 IP lamp-ubuntu-s-1vcpu-1gb-tor1-01.ssh > bras-base-toroon0569w-grc-41-174-94-67-255.dsl.bell.ca.59827: Flags [P.], seq 44765:45473, ack 4752, win 5006, options [nop,nop,TS val 95966900 ecr 2197176714], length 708
18:18:49.333781 IP bras-base-toroon0569w-grc-41-174-94-67-255.dsl.bell.ca.59827 > lamp-ubuntu-s-1vcpu-1gb-tor1-01.ssh: Flags [.], ack 45473, win 2048, options [nop,nop,TS val 2197176824 ecr 95966900], length 0
18:18:49.423575 IP lamp-ubuntu-s-1vcpu-1gb-tor1-01.ssh > bras-base-toroon0569w-grc-41-174-94-67-255.dsl.bell.ca.59827: Flags [P.], seq 45473:45949, ack 4752, win 5006, options [nop,nop,TS val 95967004 ecr 2197176824], length 476
18:18:49.434349 IP bras-base-toroon0569w-grc-41-174-94-67-255.dsl.bell.ca.59827 > lamp-ubuntu-s-1vcpu-1gb-tor1-01.ssh: Flags [.], ack 45949, win 2048, options [nop,nop,TS val 2197176923 ecr 95967004], length 0
18:18:49.527630 IP lamp-ubuntu-s-1vcpu-1gb-tor1-01.ssh > bras-base-toroon0569w-grc-41-174-94-67-255.dsl.bell.ca.59827: Flags [P.], seq 45949:46425, ack 4752, win 5006, options [nop,nop,TS val 95967108 ecr 2197176923], length 476
18:18:49.539876 IP bras-base-toroon0569w-grc-41-174-94-67-255.dsl.bell.ca.59827 > lamp-ubuntu-s-1vcpu-1gb-tor1-01.ssh: Flags [.], ack 46425, win 2048, options [nop,nop,TS val 2197177031 ecr 95967108], length 0
18:18:49.631557 IP lamp-ubuntu-s-1vcpu-1gb-tor1-01.ssh > bras-base-toroon0569w-grc-41-174-94-67-255.dsl.bell.ca.59827: Flags [P.], seq 46425:46901, ack 4752, win 5006, options [nop,nop,TS val 95967212 ecr 2197177031], length 476
